{
  "schema_version": "frankenjax.test-log.v1",
  "test_id": "fj_trace::tests::infer_one_hot_appends_num_classes_dim",
  "fixture_id": "b9263c0e5346f9c9f1b09f1669885a9d33060a061a95ae3f26676681bb8460d4",
  "seed": null,
  "mode": "strict",
  "env": {
    "rust_version": "rustc 1.95.0-nightly (7f99507f5 2026-02-19)",
    "os": "linux",
    "cargo_target_dir": "/data/tmp/cargo-target",
    "timestamp_unix_ms": 1772080789825
  },
  "artifact_refs": [
    "packet:FJ-P2C-001",
    "replay: cargo test -p fj-trace --lib fj_trace::tests::infer_one_hot_appends_num_classes_dim -- --exact --nocapture",
    "/data/projects/frankenjax/crates/fj-trace/../../artifacts/testing/logs/fj-trace/fj_trace__tests__infer_one_hot_appends_num_classes_dim.json"
  ],
  "result": "pass",
  "duration_ms": 116,
  "details": "packet_id=FJ-P2C-001;suite_id=fj-trace;result=pass",
  "phase_timings": {
    "setup_ms": 115,
    "execute_ms": 0,
    "verify_ms": 0,
    "teardown_ms": 0
  }
}