{
  "schema_version": "frankenjax.test-log.v1",
  "test_id": "fj_core::tests::transform_composition_valid_double_compositions",
  "fixture_id": "eb3c0745a5b6414fdfb5dd73f9cbf22494f357691137a4b5ed0e0bfbdd70f871",
  "seed": null,
  "mode": "strict",
  "env": {
    "rust_version": "rustc 1.95.0-nightly (7f99507f5 2026-02-19)",
    "os": "linux",
    "cargo_target_dir": "/data/tmp/cargo-target",
    "timestamp_unix_ms": 1772012870500
  },
  "artifact_refs": [
    "packet:FJ-P2C-001",
    "replay: cargo test -p fj-core --lib fj_core::tests::transform_composition_valid_double_compositions -- --exact --nocapture",
    "/data/projects/frankenjax/crates/fj-core/../../artifacts/testing/logs/fj-core/fj_core__tests__transform_composition_valid_double_compositions.json"
  ],
  "result": "pass",
  "duration_ms": 83,
  "details": "packet_id=FJ-P2C-001;suite_id=fj-core;result=pass",
  "phase_timings": {
    "setup_ms": 82,
    "execute_ms": 0,
    "verify_ms": 0,
    "teardown_ms": 0
  }
}